,state,title,caption,category,description,legiscan link
59,OK,SB26,Schools; providing certain exception to designation and use of restroom or changing area; exception for athletic activities; remedies for noncompliance. Effective date. Emergency.,BATHROOM,,https://legiscan.com/OK/text/SB26/id/2813236
60,OK,SB404,Oklahoma Religious Freedom Act; establishing exclusion from certain funds or benefits for certain reasons as substantial burden. Effective date.,OTHER,,https://legiscan.com/OK/text/SB404/id/2791904
61,OK,SB613,Health care; prohibiting gender transition procedures for children; authorizing certain civil actions and relief; licensure; adding violations and penalties. Emergency.,HEALTHCARE,,https://legiscan.com/OK/text/SB613/id/2795559
62,SD,HB1080,Prohibit certain medical and surgical interventions on minor patients.,HEALTHCARE,,https://legiscan.com/SD/text/HB1080/id/2695160
63,TN,HB0001,"AN ACT to amend Tennessee Code Annotated, Title 28; Title 29; Title 33; Title 34; Title 36; Title 37; Title 39; Title 40; Title 49; Title 56; Title 63; Title 68 and Title 71, relative to medical care of the young.",HEALTHCARE,"As enacted, prohibits a healthcare provider from performing on a minor or administering to a minor a medical procedure if the performance or administration of the procedure is for the purpose of enabling a minor to identify with, or live as, a purported identity inconsistent with the minor’s sex. - Amends TCA Title 28; Title 29; Title 33; Title 34; Title 36; Title 37; Title 39; Title 40; Title 49; Title 56; Title 63; Title 68 and Title 71.",https://legiscan.com/TN/text/HB0001/id/2756066
64,TN,HB0009,"AN ACT to amend Tennessee Code Annotated, Title 7, Chapter 51, Part 14, relative to adult-oriented performances.",OTHER,"As enacted, creates an offense for a person who engages in an adult cabaret performance on public property or in a location where the adult cabaret performance could be viewed by a person who is not an adult. - Amends TCA Title 7, Chapter 51, Part 14.",https://legiscan.com/TN/text/HB0009/id/2756096
65,TN,HB0239,"AN ACT to amend Tennessee Code Annotated, Title 1, Chapter 3 and Title 49, Chapter 2, Part 8, relative to statutory definitions.",OTHER,"As enacted, adds ""sex"" as a defined term for statutory construction purposes. - Amends TCA Title 1, Chapter 3 and Title 49, Chapter 2, Part 8.",https://legiscan.com/TN/text/HB0239/id/2817137
66,TN,HB0306,"AN ACT to amend Tennessee Code Annotated, Title 49, Chapter 1 and Title 49, Chapter 50, relative to private schools.",SPORTS,"As enacted, limits the ability of a student enrolled in a private school to participate in an interscholastic athletic activity or event, to such activity or event where membership in the Tennessee Secondary School Athletic Association is required, in accordance with the student's immutable biological sex as determined by anatomy and genetics existing at the time of birth. - Amends TCA Title 49, Chapter 1 and Title 49, Chapter 50.",https://legiscan.com/TN/text/HB0306/id/2799437
67,TN,HB1269,"AN ACT to amend Tennessee Code Annotated, Title 49, Chapter 6, relative to student pronouns.",EDUCATION,"As enacted, specifies that a teacher or other employee of a public school or LEA is not required to refer to a student using the student's preferred pronoun if the pronoun is not consistent with the student's biological sex; insulates a teacher or other employee of a public school or LEA from civil liability and adverse employment action for referring to a student using the pronoun that is consistent with the student's biological sex. - Amends TCA Title 49, Chapter 6.",https://legiscan.com/TN/text/HB1269/id/2817483
68,TN,SB0001,"AN ACT to amend Tennessee Code Annotated, Title 28; Title 29; Title 33; Title 34; Title 36; Title 37; Title 39; Title 40; Title 49; Title 56; Title 63; Title 68 and Title 71, relative to medical care of the young.",HEALTHCARE,"As enacted, prohibits a healthcare provider from performing on a minor or administering to a minor a medical procedure if the performance or administration of the procedure is for the purpose of enabling a minor to identify with, or live as, a purported identity inconsistent with the minor’s sex. - Amends TCA Title 28; Title 29; Title 33; Title 34; Title 36; Title 37; Title 39; Title 40; Title 49; Title 56; Title 63; Title 68 and Title 71.",https://legiscan.com/TN/text/SB0001/id/2755783
69,TN,SB0003,"AN ACT to amend Tennessee Code Annotated, Title 7, Chapter 51, Part 14, relative to adult-oriented performances.",OTHER,"As enacted, creates an offense for a person who engages in an adult cabaret performance on public property or in a location where the adult cabaret performance could be viewed by a person who is not an adult. - Amends TCA Title 7, Chapter 51, Part 14.",https://legiscan.com/TN/text/SB0003/id/2755954
70,TN,SB0466,"AN ACT to amend Tennessee Code Annotated, Title 49, Chapter 6, relative to student pronouns.",EDUCATION,"As enacted, specifies that a teacher or other employee of a public school or LEA is not required to refer to a student using the student's preferred pronoun if the pronoun is not consistent with the student's biological sex; insulates a teacher or other employee of a public school or LEA from civil liability and adverse employment action for referring to a student using the pronoun that is consistent with the student's biological sex. - Amends TCA Title 49, Chapter 6.",https://legiscan.com/TN/text/SB0466/id/2817217
71,TN,SB1237,"AN ACT to amend Tennessee Code Annotated, Title 49, Chapter 1 and Title 49, Chapter 50, relative to private schools.",SPORTS,"As enacted, limits the ability of a student enrolled in a private school to participate in an interscholastic athletic activity or event, to such activity or event where membership in the Tennessee Secondary School Athletic Association is required, in accordance with the student's immutable biological sex as determined by anatomy and genetics existing at the time of birth. - Amends TCA Title 49, Chapter 1 and Title 49, Chapter 50.",https://legiscan.com/TN/text/SB1237/id/2799442
72,TN,SB1440,"AN ACT to amend Tennessee Code Annotated, Title 1, Chapter 3 and Title 49, Chapter 2, Part 8, relative to statutory definitions.",OTHER,"As enacted, adds ""sex"" as a defined term for statutory construction purposes. - Amends TCA Title 1, Chapter 3 and Title 49, Chapter 2, Part 8.",https://legiscan.com/TN/text/SB1440/id/2817565
73,TX,SB12,"Relating to the authority to regulate sexually oriented performances and to restricting those performances on the premises of a commercial enterprise, on public property, or in the presence of an individual younger than 18 years of age; authorizing a civil penalty; creating a criminal offense.",OTHER,,https://legiscan.com/TX/text/SB12/id/2820314
74,TX,SB14,"Relating to prohibitions on the provision to certain children of procedures and treatments for gender transitioning, gender reassignment, or gender dysphoria and on the use of public money or public assistance to provide those procedures and treatments.",HEALTHCARE,,https://legiscan.com/TX/text/SB14/id/2811355
75,TX,SB15,Relating to requiring public institution of higher education students who compete in intercollegiate athletic competitions to compete based on biological sex.,SPORTS,,https://legiscan.com/TX/text/SB15/id/2819987
76,TX,SB17,"Relating to diversity, equity, and inclusion initiatives at public institutions of higher education.",EDUCATION,,https://legiscan.com/TX/text/SB17/id/2820276
77,UT,HB0209,Participation in Extracurricular Activities Amendments,SPORTS,,https://legiscan.com/UT/text/HB0209/id/2738992
78,UT,SB0016,Transgender Medical Treatments and Procedures Amendments,HEALTHCARE,,https://legiscan.com/UT/text/SB0016/id/2668336
79,UT,SB0093,Birth Certificate Modifications,OTHER,,https://legiscan.com/UT/text/SB0093/id/2737382
80,UT,SB0100,School Gender Identity Policies,EDUCATION,,https://legiscan.com/UT/text/SB0100/id/2685160
81,WV,HB2007,Prohibiting certain medical practices,HEALTHCARE,The purpose of this bill is to prohibit certain medical practices.,https://legiscan.com/WV/text/HB2007/id/2748657
82,WY,SF0133,Student eligibility in interscholastic sports.,SPORTS,AN ACT relating to education; prohibiting students of the male sex from competing on a team designated for students of the female sex as specified; prohibiting retaliation; providing for an administrative hearing as specified; alternatively providing for a commission to determine student eligibility as specified; providing definitions; providing immunity as specified; providing an appropriation; requiring rulemaking; and providing for an effective date.,https://legiscan.com/WY/text/SF0133/id/2725433
